video_title,views,likes,comments,release_date_time,link
The science of skin - Emma Bryce,1.8M,"34,286",,6 years ago,https://www.youtube.com/watch?v=OxPlCkTKhzY
"Why should you read ""The Handmaid's Tale""? - Naomi R. Mercer",2.2M,"78,339",,6 years ago,https://www.youtube.com/watch?v=7v-mfJMyBO0
The myth of King Midas and his golden touch - Iseult Gillespie,7.1M,"117,850",,6 years ago,https://www.youtube.com/watch?v=nn8YGPZdCvA
The life cycle of the butterfly - Franziska Bauer,346K,"10,961",329,6 years ago,https://www.youtube.com/watch?v=rcAN4rkTmNU
Can you solve the seven planets riddle? - Edwin F. Meyer,4.3M,"49,281",,6 years ago,https://www.youtube.com/watch?v=dh4nEuhZBgg
The myth of Thor's journey to the land of giants - Scott A. Mellor,8.4M,"128,858",,6 years ago,https://www.youtube.com/watch?v=e6XeP9gQPmg
The surprising reason birds sing - Partha P. Mitra,649K,"18,483",413,6 years ago,https://www.youtube.com/watch?v=r5_ZSnFDPRg
The coin flip conundrum - Po-Shen Loh,661K,"13,641",,6 years ago,https://www.youtube.com/watch?v=IAiNqQi30-Y
The rise and fall of the Inca Empire - Gordon McEwan,3.8M,"73,785",,6 years ago,https://www.youtube.com/watch?v=UO5ktwPXsyM
The myth of Arachne  - Iseult Gillespie,8.8M,"155,343",,6 years ago,https://www.youtube.com/watch?v=XvUHcsZOhJ8
How did teeth evolve? - Peter S. Ungar,746K,"17,160",,6 years ago,https://www.youtube.com/watch?v=wrPEjEqURJg
What happens during a stroke? - Vaibhav Goswami,2.9M,"79,023",,6 years ago,https://www.youtube.com/watch?v=-NJm4TJ2it0
Why is NASA sending a spacecraft to a metal world? - Linda T. Elkins-Tanton,680K,"19,700",945,6 years ago,https://www.youtube.com/watch?v=1JXq9779zwU
Ugly history: The 1937 Haitian Massacre - Edward Paulino,1.3M,"35,297","4,585",6 years ago,https://www.youtube.com/watch?v=x25k_-Katf4
Can you solve the dark coin riddle? - Lisa Winer,4.3M,"58,865",,6 years ago,https://www.youtube.com/watch?v=pnSw8g3DPHw
The myth of Oisín and the land of eternal youth - Iseult Gillespie,2.6M,"54,330",,6 years ago,https://www.youtube.com/watch?v=1nFcXcPldzY
What are mini brains? - Madeline Lancaster,590K,"17,394",635,6 years ago,https://www.youtube.com/watch?v=s_LxZx42sIk
The tragic myth of Orpheus and Eurydice - Brendan Pelsue,8.1M,"224,739",,6 years ago,https://www.youtube.com/watch?v=RhaepLsP5eg
How does your immune system work? - Emma Bryce,4.5M,"64,625",,6 years ago,https://www.youtube.com/watch?v=PSRJfaAYkW4
Who's at risk for colon cancer? - Amit H. Sachdev and Frank G. Gress,909K,"19,158",,6 years ago,https://www.youtube.com/watch?v=H5zin8jKeT0
How to manage your time more effectively (according to machines) - Brian Christian,6.8M,"193,484",,6 years ago,https://www.youtube.com/watch?v=iDbdXTMnOmE
Why should you read Charles Dickens? - Iseult Gillespie,1.8M,"54,854",,6 years ago,https://www.youtube.com/watch?v=5czA_L_eOp4
Why do animals form swarms? - Maria R. D'Orsogna,318K,"8,904",242,6 years ago,https://www.youtube.com/watch?v=y6u1GPpJuR4
How your digestive system works - Emma Bryce,11M,"172,879",,6 years ago,https://www.youtube.com/watch?v=Og5xAdC8EUI
Why is Herodotus called “The Father of History”? - Mark Robinson,2.3M,"45,414",,6 years ago,https://www.youtube.com/watch?v=A542ixwyBhc
Can 100% renewable energy power the world? - Federico Rosei and Renzo Rosei,2.5M,"42,327",,6 years ago,https://www.youtube.com/watch?v=RnvCbquYeIM
How long will human impacts last? - David Biello,800K,"15,851",704,6 years ago,https://www.youtube.com/watch?v=Zsc8G0NnMTs
How do fish make electricity? - Eleanor Nelsen,3.3M,"67,291","2,056",6 years ago,https://www.youtube.com/watch?v=z0M7_HPSi14
History vs. Che Guevara - Alex Gendler,5M,"143,832","13,926",6 years ago,https://www.youtube.com/watch?v=tjrvKA4w9-Y
What is the tragedy of the commons? - Nicholas Amendolare,2.9M,"86,095","2,353",6 years ago,https://www.youtube.com/watch?v=CxC161GvMPc
How often should you get a flu shot? - Melvin Sanicas,937K,"17,625",,6 years ago,https://www.youtube.com/watch?v=FZ_jNGKCIWs
The complicated history of surfing - Scott Laderman,1.4M,"38,250",,6 years ago,https://www.youtube.com/watch?v=jyn_orqdyHQ
The myth of Prometheus - Iseult Gillespie,8.7M,"177,278","4,830",6 years ago,https://www.youtube.com/watch?v=U_u91SjrEOE
How does your body know you're full? - Hilary Coller,2.4M,"53,917",,6 years ago,https://www.youtube.com/watch?v=YVfyYrEmzgM
Why incompetent people think they're amazing - David Dunning,11M,"346,915","14,311",6 years ago,https://www.youtube.com/watch?v=pOLmD_WVY-E
Can you solve the egg drop riddle? - Yossi Elran,8.1M,"81,640",,6 years ago,https://www.youtube.com/watch?v=NGtt7GJ1uiM
How many verb tenses are there in English? - Anna Ananichuk,862K,"23,322","1,102",6 years ago,https://www.youtube.com/watch?v=54prMaPn5Ls
"Why should you read ""Macbeth""? - Brendan Pelsue",3.4M,"106,525","2,109",6 years ago,https://www.youtube.com/watch?v=rD5goS69LT4
How to make your writing suspenseful - Victoria Smith,2.7M,"105,171",,6 years ago,https://www.youtube.com/watch?v=xjKruwAfZWk
Where do math symbols come from? - John David Walters,2.4M,"55,239",,6 years ago,https://www.youtube.com/watch?v=eVm063xmnow
How your muscular system works - Emma Bryce,2.5M,"32,253",,6 years ago,https://www.youtube.com/watch?v=VVL-8zr2hk4
"Why should you read James Joyce's ""Ulysses""? - Sam Slote",2.9M,"72,651",,6 years ago,https://www.youtube.com/watch?v=X7FobPxu27M
What in the world is topological quantum matter? - Fan Zhang,624K,"17,611",,6 years ago,https://www.youtube.com/watch?v=GJHhnr9R_ZM
"Why should you read Virgil's ""Aeneid""? - Mark Robinson",1M,"26,794",,6 years ago,https://www.youtube.com/watch?v=p4mbk59rbjE
How did Polynesian wayfinders navigate the Pacific Ocean? - Alan Tamayose and Shantell De Silva,1.7M,"43,113",,6 years ago,https://www.youtube.com/watch?v=m8bDCaPhOek
The first asteroid ever discovered - Carrie Nugent,292K,"8,816",,6 years ago,https://www.youtube.com/watch?v=VKMWqOfbGME
Explore cave paintings in this 360° animated cave - Iseult Gillespie,576K,"10,128",,6 years ago,https://www.youtube.com/watch?v=CX4KuIBmnjI
Why is it so hard to cure cancer? - Kyuson Yun,6.7M,"165,695",,6 years ago,https://www.youtube.com/watch?v=h2rR77VsF5c
Is DNA the future of data storage? - Leo Bear-McGuinness,390K,"15,522",,6 years ago,https://www.youtube.com/watch?v=r8qWc9X4f6k
Why should you read Virginia Woolf? - Iseult Gillespie,2.9M,"131,465",,6 years ago,https://www.youtube.com/watch?v=DcMLkce_BLg
The strange case of the cyclops sheep - Tien Nguyen,1.7M,"48,142",,6 years ago,https://www.youtube.com/watch?v=Fzz-Pblbvqw
How aspirin was discovered - Krishna Sudhir,2.9M,"72,793",,6 years ago,https://www.youtube.com/watch?v=uRhkDN2WjzI
The surprising cause of stomach ulcers - Rusha Modi,3.6M,"107,669",,6 years ago,https://www.youtube.com/watch?v=V_U6czbDHLE
A brief history of banned numbers - Alessandra King,2.6M,"53,826",,6 years ago,https://www.youtube.com/watch?v=VmWVXOIQblM
Are you a body with a mind or a mind with a body? - Maryam Alimardani,3.1M,"108,096",,6 years ago,https://www.youtube.com/watch?v=ILDy6kYU-xQ
Why do we harvest horseshoe crab blood? - Elizabeth Cox,2.3M,"49,160",,6 years ago,https://www.youtube.com/watch?v=VgEbcQxFUu8
Should we get rid of standardized testing? - Arlo Kempf,1.1M,"31,227",,6 years ago,https://www.youtube.com/watch?v=YtE0OsRWeYI
How do executive orders work? - Christina Greer,1.2M,"21,392",,6 years ago,https://www.youtube.com/watch?v=oyOf3g-PJ94
What are gravitational waves? - Amber L. Stuver,931K,"32,676",,6 years ago,https://www.youtube.com/watch?v=hebGhsNsjG0
Is it possible to create a perfect vacuum? - Rolf Landua and Anais Rassat,1M,"27,584",,6 years ago,https://www.youtube.com/watch?v=_rJOSDgDG0A
How many ways are there to prove the Pythagorean theorem? - Betty Fei,3.6M,"94,214",,6 years ago,https://www.youtube.com/watch?v=YompsDlEdtc
Where do new words come from? - Marcel Danesi,1.3M,"28,102",,6 years ago,https://www.youtube.com/watch?v=Ytr28t5VzAs
The life cycle of a t-shirt - Angel Chang,3M,"53,043",,6 years ago,https://www.youtube.com/watch?v=BiSYoeqb_VY
The science of smog - Kim Preshoff,1M,"22,186",,6 years ago,https://www.youtube.com/watch?v=CdbBwIgq4rs
The amazing ways plants defend themselves - Valentin Hammoudi,4.1M,"73,952",,6 years ago,https://www.youtube.com/watch?v=Hja0SLs2kus
How does impeachment work? - Alex Gendler,2M,"47,029",,6 years ago,https://www.youtube.com/watch?v=hSszixvo7d8
Cell membranes are way more complicated than you think - Nazzy Pakpour,869K,"15,339",,6 years ago,https://www.youtube.com/watch?v=nsklF1w4eok
Could we create dark matter? - Rolf Landua,1.4M,"52,905",,6 years ago,https://www.youtube.com/watch?v=h2MlS09KJP4
The rise and fall of the Berlin Wall - Konrad H. Jarausch,8.9M,"165,320",,6 years ago,https://www.youtube.com/watch?v=A9fQPzZ1-hg
TED-Ed is on Patreon! We need your help to revolutionize education...,1.1M,"7,845",,6 years ago,https://www.youtube.com/watch?v=1kSEmgIJNqE
Will the ocean ever run out of fish? - Ayana Elizabeth Johnson and Jennifer Jacquet,1.4M,"24,233",,6 years ago,https://www.youtube.com/watch?v=WNdR808jMSA
When is water safe to drink? - Mia Nacamulli,1.3M,"22,723",,6 years ago,https://www.youtube.com/watch?v=G244Q4AGJ7U
The myth of Cupid and Psyche - Brendan Pelsue,9.8M,"200,646",,6 years ago,https://www.youtube.com/watch?v=Gjj_-CPxjCM
Will we ever be able to teleport? - Sajan Saini,3.1M,"69,971",,6 years ago,https://www.youtube.com/watch?v=JMdO5KyjwAw
What happens when you have a concussion? - Clifford Robbins,2.2M,"41,181",,6 years ago,https://www.youtube.com/watch?v=xvjK-4NXRsM
The left brain vs. right brain myth - Elizabeth Waters,1M,"20,665",,6 years ago,https://www.youtube.com/watch?v=ZMSbDwpIyF4
Can you find the next number in this sequence? - Alex Gendler,560K,"11,324",,6 years ago,https://www.youtube.com/watch?v=LpjX3kHXcR0
How does caffeine keep us awake? - Hanan Qasim,5.3M,"113,935",,7 years ago,https://www.youtube.com/watch?v=foLf5Bi9qXs
How does fracking work? - Mia Nacamulli,2.6M,"36,817",,7 years ago,https://www.youtube.com/watch?v=Tudal_4x4F0
How to spot a misleading graph - Lea Gaslowitz,2.9M,"83,204",,7 years ago,https://www.youtube.com/watch?v=E91bGT9BjYk
What causes kidney stones? - Arash Shadman,6.1M,"104,591",,7 years ago,https://www.youtube.com/watch?v=W0GpIMNTPYg
How do drugs affect the brain? - Sara Garofalo,1.5M,"22,855",,7 years ago,https://www.youtube.com/watch?v=8qK0hxuXOC8
Can you solve the fish riddle? -  Steve Wyborney,6.2M,"68,393",,7 years ago,https://www.youtube.com/watch?v=lLOALyWls2k
Who built Great Zimbabwe? And why? - Breeanna Elliott,1.1M,"23,080",,7 years ago,https://www.youtube.com/watch?v=quzjmZ-7s6w
How to squeeze electricity out of crystals - Ashwini Bharathula,657K,"20,440",,7 years ago,https://www.youtube.com/watch?v=YEJ2qryXcIQ
The philosophy of Stoicism - Massimo Pigliucci,9.9M,"368,397",,7 years ago,https://www.youtube.com/watch?v=R9OCA6UFE-0
What can you learn from ancient skeletons? - Farnaz Khatibi,410K,"7,339",,7 years ago,https://www.youtube.com/watch?v=T24hdchCVIg
The power of creative constraints - Brandon Rodriguez,567K,"14,248",,7 years ago,https://www.youtube.com/watch?v=v5FL9VTBZzQ
Why do people join cults? - Janja Lalich,5.5M,"135,358",,7 years ago,https://www.youtube.com/watch?v=kB-dJaCXAxA
The genius of Marie Curie - Shohini Ghose,3.7M,"119,352",,7 years ago,https://www.youtube.com/watch?v=w6JFRi0Qm_s
The ferocious predatory dinosaurs of Cretaceous Sahara - Nizar Ibrahim,1.9M,"24,379",,7 years ago,https://www.youtube.com/watch?v=8RI0JnB_OaE
Why don't perpetual motion machines ever work? - Netta Schramm,16M,"326,490",,7 years ago,https://www.youtube.com/watch?v=A-QgGXbDyR0
How the bendy straw was invented | Moments of Vision 12 - Jessica Oreck,421K,"7,668",,7 years ago,https://www.youtube.com/watch?v=9keTby6wcrk
"Who were the Vestal Virgins, and what was their job? - Peta Greenfield",9.7M,"174,211",,7 years ago,https://www.youtube.com/watch?v=ER0Cu0KQFqM
The world’s most mysterious book - Stephen Bax,9.6M,"247,156",,7 years ago,https://www.youtube.com/watch?v=8NS4CbBJQ84
How does money laundering work? - Delena D. Spann,6.2M,"118,195",,7 years ago,https://www.youtube.com/watch?v=257wV-AbKaE
History’s deadliest colors - J. V. Maranto,8.1M,"140,502",,7 years ago,https://www.youtube.com/watch?v=gKfjHTk8KrY
A brief history of goths - Dan Adams,3.8M,"117,385",,7 years ago,https://www.youtube.com/watch?v=STOJftffOqs
The history of tea - Shunan Teng,6.7M,"134,737",,7 years ago,https://www.youtube.com/watch?v=LaLvVc1sS20
How does your body process medicine? - Céline Valéry,4.5M,"105,537",,7 years ago,https://www.youtube.com/watch?v=uOcpsXMJcJk
How does asthma work? - Christopher E. Gaw,7.9M,"148,521",,7 years ago,https://www.youtube.com/watch?v=PzfLDi-sL3w
What is entropy? - Jeff Phillips,4.3M,"103,919",,7 years ago,https://www.youtube.com/watch?v=YM-uykVfq_E
How do nuclear power plants work? - M. V. Ramana and Sajan Saini,3.1M,"41,529",,7 years ago,https://www.youtube.com/watch?v=R7WPEYGr1Vs
Check your intuition: The birthday problem - David Knuffke,2.7M,"53,850",,7 years ago,https://www.youtube.com/watch?v=KtT_cgMzHx8
How the popsicle was invented | Moments of Vision 11 - Jessica Oreck,454K,"7,092",,7 years ago,https://www.youtube.com/watch?v=yA00JNZYu7k
Can you solve the pirate riddle? - Alex Gendler,10M,"129,896",,7 years ago,https://www.youtube.com/watch?v=Mc6VA7Q1vXQ
"Why should you read Tolstoy's ""War and Peace""? - Brendan Pelsue",5.2M,"143,275",,7 years ago,https://www.youtube.com/watch?v=4dn7TEjnbPY
Why are sloths so slow? - Kenny Coogan,5.9M,"106,605",,7 years ago,https://www.youtube.com/watch?v=-64U7WoBrqM
The evolution of animal genitalia - Menno Schilthuizen,2.9M,"66,199","3,483",7 years ago,https://www.youtube.com/watch?v=vcPJkz-D5II
How did Dracula become the world's most famous vampire? - Stanley Stepanic,3.8M,"70,672","2,522",7 years ago,https://www.youtube.com/watch?v=7uiyz3139tE
Secrets of the X chromosome - Robin Ball,1.1M,"23,297",,7 years ago,https://www.youtube.com/watch?v=veB31XmUQm8
The three different ways mammals give birth - Kate Slabosky,6.8M,"112,238",,7 years ago,https://www.youtube.com/watch?v=sz3Yv3On4lE
Oxygen’s surprisingly complex journey through your body - Enda Butler,3M,"53,609",,7 years ago,https://www.youtube.com/watch?v=GVU_zANtroE
Why do we itch? - Emma Bryce,7.1M,"106,069",,7 years ago,https://www.youtube.com/watch?v=0NGei3H8yRk
How do focus groups work? - Hector Lanz,833K,"10,573",,7 years ago,https://www.youtube.com/watch?v=3TwgVQIZPsw
How blue jeans were invented | Moments of Vision 10 - Jessica Oreck,474K,"7,181",,7 years ago,https://www.youtube.com/watch?v=SCRYuUlU_Gs
Why do animals have such different lifespans? - Joao Pedro de Magalhaes,5.5M,"93,821",,7 years ago,https://www.youtube.com/watch?v=7m8QlSPP7t0
Can you solve the virus riddle? - Lisa Winer,12M,"127,745",,7 years ago,https://www.youtube.com/watch?v=ZKh6z0X6KRw
How Magellan circumnavigated the globe - Ewandro Magalhaes,1.7M,"26,813",,7 years ago,https://www.youtube.com/watch?v=pFdiX8mj0Es
Jellyfish predate dinosaurs. How have they survived so long? - David Gruber,3.3M,"66,307",,7 years ago,https://www.youtube.com/watch?v=yQduHyiWe9o
Why do people get so anxious about math? - Orly Rubinsten,2.8M,"115,267",,7 years ago,https://www.youtube.com/watch?v=7snnRaC4t5c
How the food you eat affects your gut - Shilpa Ravella,6.3M,"125,448",,7 years ago,https://www.youtube.com/watch?v=1sISguPDlhY
"Meet the tardigrade, the toughest animal on Earth - Thomas Boothby",4.8M,"83,388",,7 years ago,https://www.youtube.com/watch?v=IxndOd3kmSs
What makes a poem … a poem? - Melissa Kovacs,3.6M,"76,826",,7 years ago,https://www.youtube.com/watch?v=JwhouCNq-Fc
The history of chocolate - Deanna Pucciarelli,9.8M,"155,904",,7 years ago,https://www.youtube.com/watch?v=ibjUpk9Iagk
What is McCarthyism? And how did it happen? - Ellen Schrecker,3.7M,"66,147",,7 years ago,https://www.youtube.com/watch?v=N35IugBYH04
The myth of Icarus and Daedalus - Amy Adkins,8.5M,"133,412",,7 years ago,https://www.youtube.com/watch?v=3s2QPQnuaGk
Where do superstitions come from? - Stuart Vyse,4.9M,"100,354",,7 years ago,https://www.youtube.com/watch?v=quOdF1CAPXs
How Braille was invented | Moments of Vision 9 - Jessica Oreck,479K,"9,355",,7 years ago,https://www.youtube.com/watch?v=cyfxQ6sdaIE
"Does ""The Wonderful Wizard of Oz"" have a hidden message? - David B. Parker",1.5M,"34,648",,7 years ago,https://www.youtube.com/watch?v=7Lg4vjRY4Ts
What happened to trial by jury? - Suja A. Thomas,800K,"13,898",,7 years ago,https://www.youtube.com/watch?v=qVoYFYxGJPg
TED-Ed Clubs: Celebrating and amplifying student voices around the world,51K,"2,000",,7 years ago,https://www.youtube.com/watch?v=U2PG_R4wl-0
Are ghost ships real? - Peter B. Campbell,2.9M,"54,378",,7 years ago,https://www.youtube.com/watch?v=cURn__xlWXk
How to practice effectively...for just about anything - Annie Bosler and Don Greene,13M,"517,959",,7 years ago,https://www.youtube.com/watch?v=f2O6mQkFiiw
"Everything you need to know to read ""Frankenstein"" - Iseult Gillespie",1.6M,"36,430",,7 years ago,https://www.youtube.com/watch?v=PDgu25Dsv34
Can you solve the three gods riddle? - Alex Gendler,12M,"172,981",,7 years ago,https://www.youtube.com/watch?v=LKvjIsyYng8
The exceptional life of Benjamin Banneker - Rose-Margaret Ekeng-Itua,685K,"13,936",,7 years ago,https://www.youtube.com/watch?v=DKnwyVR4P88
What happens during a heart attack? - Krishna Sudhir,8.3M,"149,778",,7 years ago,https://www.youtube.com/watch?v=3_PYnWVoUzM
How small are we in the scale of the universe? - Alex Hofeldt,1M,"24,380",,7 years ago,https://www.youtube.com/watch?v=WYQ3O8U6SMY
What is bipolar disorder? - Helen M. Farrell,13M,"276,560",,7 years ago,https://www.youtube.com/watch?v=RrWBhVlD1H8
Would winning the lottery make you happier? - Raj Raghunathan,1.1M,"18,576",,7 years ago,https://www.youtube.com/watch?v=juO4zxsjSjw
How super glue was invented | Moments of Vision 8 - Jessica Oreck,394K,"6,678",,7 years ago,https://www.youtube.com/watch?v=K2mv7kX3q2s
History vs. Cleopatra - Alex Gendler,6.7M,"124,079",,7 years ago,https://www.youtube.com/watch?v=Y6EhRwn4zkc
The science of milk - Jonathan J. O'Sullivan,2.8M,"43,631",,7 years ago,https://www.youtube.com/watch?v=xmNzUEmFZMg
"Everything you need to know to read Homer's ""Odyssey"" - Jill Dash",1.9M,"31,911",,7 years ago,https://www.youtube.com/watch?v=8Z9FQxcCAZ0
The myth behind the Chinese zodiac - Megan Campisi and Pen-Pen Chen,8.5M,"135,819",,7 years ago,https://www.youtube.com/watch?v=may2s9j4RLk
Mary's Room: A philosophical thought experiment - Eleanor Nelsen,4.2M,"131,399",,7 years ago,https://www.youtube.com/watch?v=mGYmiQkah4o
The mathematics of sidewalk illusions - Fumiko Futamura,797K,"13,990",,7 years ago,https://www.youtube.com/watch?v=wujEE3PRVUo
A brief history of numerical systems - Alessandra King,1M,"15,195",,7 years ago,https://www.youtube.com/watch?v=cZH0YnFpjwU
How do animals experience pain? - Robyn J. Crook,3.6M,"67,770",,7 years ago,https://www.youtube.com/watch?v=5j9Syov0AAw
Would you sacrifice one person to save five? - Eleanor Nelsen,5.1M,"113,947",,7 years ago,https://www.youtube.com/watch?v=yg16u_bzjPE
What’s so great about the Great Lakes? - Cheri Dobbs and Jennifer Gabrys,1.6M,"20,905",,7 years ago,https://www.youtube.com/watch?v=gBRcOLcEwF0
How to master your sense of smell - Alexandra Horowitz,584K,"12,357",,7 years ago,https://www.youtube.com/watch?v=ynrbxy36erE
What does this symbol actually mean? - Adrian Treharne,1.9M,"27,481",,7 years ago,https://www.youtube.com/watch?v=ppNYZq-hYTw
Can you solve the counterfeit coin riddle? - Jennifer Lu,8.7M,"86,142",,7 years ago,https://www.youtube.com/watch?v=tE2dZLDJSjA
How the stethoscope was invented | Moments of Vision 7 - Jessica Oreck,402K,"6,160",,7 years ago,https://www.youtube.com/watch?v=0bxiOMJAMW8
Why are we so attached to our things? - Christian Jarrett,2.6M,"64,010",,7 years ago,https://www.youtube.com/watch?v=H2_by0rp5q0
Why do we kiss under mistletoe? - Carlos Reif,951K,"15,696",,7 years ago,https://www.youtube.com/watch?v=QtJqBiF6EF0
Why do airlines sell too many tickets? - Nina Klietsch,,,,7 years ago,https://www.youtube.com/watch?v=ZFNstNKgEDI
Is there a limit to technological progress? - Clément Vidal,,,,7 years ago,https://www.youtube.com/watch?v=zVsHzS70krg
How high can you count on your fingers? (Spoiler: much higher than 10) - James Tanton,,,,7 years ago,https://www.youtube.com/watch?v=UixU1oRW64Q
Why doesn’t anything stick to Teflon? - Ashwini Bharathula,,,,7 years ago,https://www.youtube.com/watch?v=uXaP43Zbz7U
The science of imagination - Andrey Vyshedskiy,,,,7 years ago,https://www.youtube.com/watch?v=e7uXAlXdTe4
How does your body know what time it is? - Marco A. Sotomayor,,,,7 years ago,https://www.youtube.com/watch?v=Y8ZXOfWUbms
How smudge-proof lipstick was invented | Moments of Vision 6 - Jessica Oreck,,,,7 years ago,https://www.youtube.com/watch?v=MpkDx6nLn1A
Is there a reproducibility crisis in science? - Matt Anticole,,,,7 years ago,https://www.youtube.com/watch?v=FpCrY7x5nEE
Can you solve the airplane riddle? - Judd A. Schorr,,,,7 years ago,https://www.youtube.com/watch?v=dzrwnwOx0fw
Can machines read your emotions? - Kostas Karpouzis,,,,7 years ago,https://www.youtube.com/watch?v=QFk3e5PcK7s
What's the fastest way to alphabetize your bookshelf? - Chand John,,,,7 years ago,https://www.youtube.com/watch?v=WaNLJf8xzC4
The secrets of Mozart’s “Magic Flute” - Joshua Borths,,,,7 years ago,https://www.youtube.com/watch?v=8iKd-P4Bcac
Why do we feel nostalgia? - Clay Routledge,,,,7 years ago,https://www.youtube.com/watch?v=WiTgn5QH_HU
How do US Supreme Court justices get appointed? - Peter Paccone,,,,7 years ago,https://www.youtube.com/watch?v=0xnzGSV66x4
How to recognize a dystopia - Alex Gendler,,,,7 years ago,https://www.youtube.com/watch?v=6a6kbU88wu0
Do we really need pesticides? - Fernan Pérez-Gálvez,,,,7 years ago,https://www.youtube.com/watch?v=GLllZ-qiXJA
Why do whales sing? - Stephanie Sardelis,,,,7 years ago,https://www.youtube.com/watch?v=7Xr9BYhlceA
Are food preservatives bad for you? - Eleanor Nelsen,,,,7 years ago,https://www.youtube.com/watch?v=ZJU34yTJL4M
Why are sharks so awesome? - Tierney Thys,,,,7 years ago,https://www.youtube.com/watch?v=svlEfxTyJQE
How the sandwich was invented | Moments of Vision 5 - Jessica Oreck,,,,7 years ago,https://www.youtube.com/watch?v=7k6n46xBTxs
Can you solve the river crossing riddle? - Lisa Winer,,,,7 years ago,https://www.youtube.com/watch?v=ADR7dUoVh_c
The Egyptian Book of the Dead: A guidebook for the underworld - Tejal Gala,,,,7 years ago,https://www.youtube.com/watch?v=1yv_MXNYbAo
What caused the French Revolution? - Tom Mullaney,,,,7 years ago,https://www.youtube.com/watch?v=PBn7iWzrKoI
Plato’s best (and worst) ideas - Wisecrack,,,,7 years ago,https://www.youtube.com/watch?v=jLesc5lITvo
"Why should you listen to Vivaldi's ""Four Seasons""? - Betsy Schwarm",,,,7 years ago,https://www.youtube.com/watch?v=Xcpc8VDsv3c
How much of human history is on the bottom of the ocean? - Peter Campbell,,,,7 years ago,https://www.youtube.com/watch?v=kSBB5PsRV-k
"Why is Vermeer's ""Girl with the Pearl Earring"" considered a masterpiece? - James Earle",,,,7 years ago,https://www.youtube.com/watch?v=pM_IzEAv5d4
What causes cavities? - Mel Rosenberg,,,,7 years ago,https://www.youtube.com/watch?v=zGoBFU1q4g0
What happens to our bodies after we die? - Farnaz Khatibi Jafari,,,,7 years ago,https://www.youtube.com/watch?v=mRsa2wb0aTs
How the rubber glove was invented | Moments of Vision 4 - Jessica Oreck,,,,7 years ago,https://www.youtube.com/watch?v=2qlcO3xUz3Q
Is it bad to hold your pee? - Heba Shaheed,,,,7 years ago,https://www.youtube.com/watch?v=Ze4Qmpq48AQ
How does the Nobel Peace Prize work? - Adeline Cuvelier and Toril Rokseth,,,,7 years ago,https://www.youtube.com/watch?v=rXhpK_lhonA
Could we survive prolonged space travel? - Lisa Nip,,,,7 years ago,https://www.youtube.com/watch?v=upp9-w6GPhU
Can you solve the prisoner boxes riddle? - Yossi Elran,,,,7 years ago,https://www.youtube.com/watch?v=vIdStMTgNl0
Could human civilization spread across the whole galaxy? - Roey Tzezana,,,,7 years ago,https://www.youtube.com/watch?v=Rpy9Qp7NAaw
The history of African-American social dance - Camille A. Brown,,,,7 years ago,https://www.youtube.com/watch?v=dpCBMwAweDI
The history of the Cuban Missile Crisis - Matthew A. Jordan,,,,7 years ago,https://www.youtube.com/watch?v=bwWW3sbk4EU
Why are there so many types of apples? - Theresa Doud,,,,7 years ago,https://www.youtube.com/watch?v=mQePz62zkqA
How to use rhetoric to get what you want - Camille A. Langston,,,,7 years ago,https://www.youtube.com/watch?v=3klMM9BkW5o
How do contraceptives work? - NWHunter,,,,7 years ago,https://www.youtube.com/watch?v=Zx8zbTMTncs
Aphasia: The disorder that makes you lose your words - Susan Wortman-Jutt,,,,7 years ago,https://www.youtube.com/watch?v=-GsVhbmecJA
What is a vector? - David Huynh,,,,7 years ago,https://www.youtube.com/watch?v=ml4NSzCQobk
How the Band-Aid was invented | Moments of Vision 3 - Jessica Oreck,,,,7 years ago,https://www.youtube.com/watch?v=98sFkESm0xg
Is graffiti art? Or vandalism? - Kelly Wall,,,,7 years ago,https://www.youtube.com/watch?v=4GNoUYZhrT0
One of the most difficult words to translate... - Krystian Aparta,,,,7 years ago,https://www.youtube.com/watch?v=fNV7CsKI5m8
How the Königsberg bridge problem changed mathematics - Dan Van der Vieren,,,,7 years ago,https://www.youtube.com/watch?v=nZwSo4vfw6c
How smart are orangutans? - Lu Gao,,,,7 years ago,https://www.youtube.com/watch?v=gFzqqaBA9wQ
The paradox of value - Akshita Agarwal,,,,7 years ago,https://www.youtube.com/watch?v=e7S8jWh6AEs
