video_title,views,likes,comments,release_date_time,link
The neurons that shaped civilization - VS Ramachandran,,,,10 years ago,https://www.youtube.com/watch?v=l80zgw07W4Y
The beautiful tricks of flowers - Jonathan Drori,,,,10 years ago,https://www.youtube.com/watch?v=25GOatovFIM
"Your online life, permanent as a tattoo - Juan Enriquez",,,,10 years ago,https://www.youtube.com/watch?v=pRXmEPZNkpY
The key to growth? Race with the machines - Erik Brynjolfsson,,,,10 years ago,https://www.youtube.com/watch?v=lsdgdgJb3IM
Txtng is killing language. JK!!! - John McWhorter,,,,10 years ago,https://www.youtube.com/watch?v=VrQLDT_1Q_k
The art of asking - Amanda Palmer,,,,10 years ago,https://www.youtube.com/watch?v=3xHURCCswAY
A clean energy proposal -- race to the top! - Jennifer Granholm,,,,10 years ago,https://www.youtube.com/watch?v=XuNgH74BpG0
How we found the giant squid - Edith Widder,,,,10 years ago,https://www.youtube.com/watch?v=0Wb5obt7QO0
We need better drugs -- now - Francis Collins,,,,10 years ago,https://www.youtube.com/watch?v=dSFZJk6qCcc
Why do Americans and Canadians celebrate Labor Day? -Kenneth C. Davis,,,,10 years ago,https://www.youtube.com/watch?v=YqmPE2HtkyU
Are droids taking our jobs? - Andrew McAfee,,,,10 years ago,https://www.youtube.com/watch?v=7EzGs0AtJVw
Demand a fair trade cell phone - Bandi Mbubi,,,,10 years ago,https://www.youtube.com/watch?v=FVENysRzu3E
"Design for people, not awards - Timothy Prestero",,,,10 years ago,https://www.youtube.com/watch?v=gtjy1zZrwhA
How to step up in the face of disaster - Caitria + Morgan O'Neill,,,,10 years ago,https://www.youtube.com/watch?v=vveGnERb9uM
A teacher growing green in the South Bronx - Stephen Ritz,,,,10 years ago,https://www.youtube.com/watch?v=mZC-kzM_E4o
"The future race car -- 150mph, and no driver - Chris Gerdes",,,,10 years ago,https://www.youtube.com/watch?v=qW0M5m4p9YY
What's your 200-year plan? - Raghava KK,,,,10 years ago,https://www.youtube.com/watch?v=XAjalGXoLOA
Four ways to understand the Earth's age - Joshua M. Sneideman,,,,10 years ago,https://www.youtube.com/watch?v=tkxWmh-tFGs
Reinventing the encyclopedia game - Rives,,,,10 years ago,https://www.youtube.com/watch?v=z_rrcpN9Hoc
What is déjà vu? What is déjà vu? - Michael Molina,,,,10 years ago,https://www.youtube.com/watch?v=foVMwJtlR5s
"The Higgs Field, explained - Don Lincoln",,,,10 years ago,https://www.youtube.com/watch?v=joTKd5j3mzk
Gravity and the human body - Jay Buckey,,,,10 years ago,https://www.youtube.com/watch?v=7CuYx9mZCQA
The 3 A's of awesome - Neil Pasricha,,,,10 years ago,https://www.youtube.com/watch?v=DWDbxcvmsHk
On reading the Koran - Lesley Hazleton,,,,10 years ago,https://www.youtube.com/watch?v=xOnwG_GgAqg
True success - John Wooden,,,,10 years ago,https://www.youtube.com/watch?v=3s_hlvhwmvg
How to use experts—and when not to - Noreena Hertz,,,,10 years ago,https://www.youtube.com/watch?v=jLqLG-01Thw
The art of choosing - Sheena Iyengar,,,,10 years ago,https://www.youtube.com/watch?v=h3Tp_nscwjM
Where is home? - Pico Iyer,,,,10 years ago,https://www.youtube.com/watch?v=86HB9uQ2ZS4
Meet global corruption's hidden players - Charmian Gooch,,,,10 years ago,https://www.youtube.com/watch?v=gE9KAJ8ui3A
A Saudi woman who dared to drive - Manal al-Sharif,,,,10 years ago,https://www.youtube.com/watch?v=aZ47h37CGE0
Is the obesity crisis hiding a bigger problem? - Peter Attia,,,,10 years ago,https://www.youtube.com/watch?v=sjJrXHWLP_M
"The emergence of ""4D printing"" - Skylar Tibbits",,,,10 years ago,https://www.youtube.com/watch?v=9EW5JuKw588
"We the People, and the Republic we must reclaim - Lawrence Lessig",,,,10 years ago,https://www.youtube.com/watch?v=BWeoeqXPOqQ
A mini robot -- powered by your phone - Keller Rinaudo,,,,10 years ago,https://www.youtube.com/watch?v=ayMn1T3nQUQ
"The good news on poverty (Yes, there's good news) - Bono",,,,10 years ago,https://www.youtube.com/watch?v=Pe2unbv2rRA
Mysteries of vernacular: Bewilder - Jessica Oreck and Rachael Teel,,,,10 years ago,https://www.youtube.com/watch?v=dxLLAe-k1W4
Shakespearean dating tips - Anthony John Peters,,,,10 years ago,https://www.youtube.com/watch?v=ZNMwhaSHK9Q
The other inconvenient truth - Jonathan Foley,,,,10 years ago,https://www.youtube.com/watch?v=Igwitg9zFvQ
Older people are happier - Laura Carstensen,,,,10 years ago,https://www.youtube.com/watch?v=CAdJcnrSgR8
How to buy happiness - Michael Norton,,,,10 years ago,https://www.youtube.com/watch?v=Rqj7besaGg4
How to use a paper towel - Joe Smith,,,,10 years ago,https://www.youtube.com/watch?v=KnU1Pioy13s
Gaming for understanding - Brenda Brathwaite,,,,10 years ago,https://www.youtube.com/watch?v=lH83NyjoXbU
Perspective is everything - Rory Sutherland,,,,10 years ago,https://www.youtube.com/watch?v=uXKilrFGd2U
A teen just trying to figure it out - Tavi Gevinson,,,,10 years ago,https://www.youtube.com/watch?v=1TS6YW7rzIo
Religions and babies - Hans Rosling,,,,10 years ago,https://www.youtube.com/watch?v=hbrfZD0cnjY
What your designs say about you - Sebastian Deterding,,,,10 years ago,https://www.youtube.com/watch?v=7mcuWJJK2YQ
ET is (probably) out there -- get ready - Seth Shostak,,,,10 years ago,https://www.youtube.com/watch?v=t0m8WdR1FcQ
Will our kids be a different species? - Juan Enriquez,,,,10 years ago,https://www.youtube.com/watch?v=bWWPs35lTjE
The myth of the gay agenda - LZ Granderson,,,,10 years ago,https://www.youtube.com/watch?v=UFaa6CnXMdg
Pop an ollie and innovate! - Rodney Mullen,,,,10 years ago,https://www.youtube.com/watch?v=5zeGl5Jz03o
Women should represent women in media - Megan Kamerick,,,,10 years ago,https://www.youtube.com/watch?v=IaBJFSAxVgY
Lessons from death row inmates - David R. Dow,,,,10 years ago,https://www.youtube.com/watch?v=lleIWB8KalU
Tour the solar system from home - Jon Nguyen,,,,10 years ago,https://www.youtube.com/watch?v=UtNHCwmWYhY
India's invisible innovation - Nirmalya Kumar,,,,10 years ago,https://www.youtube.com/watch?v=zodVSlOuShc
Overcoming obstacles - Steven Claunch,,,,10 years ago,https://www.youtube.com/watch?v=2MGMvEnoD6U
Defining cyberwarfare...in hopes of preventing it - Daniel Garrie,,,,10 years ago,https://www.youtube.com/watch?v=ZVoDwtyvDJc
The Arctic vs. the Antarctic - Camille Seaman,,,,10 years ago,https://www.youtube.com/watch?v=Z5VRoGTF60s
How to learn? From mistakes - Diana Laufenberg,,,,10 years ago,https://www.youtube.com/watch?v=syEOMOIGK0Q
"The walk from ""no"" to ""yes"" - William Ury",,,,10 years ago,https://www.youtube.com/watch?v=t-Gj-wBCClY
Navigating Our Global Future - Ian Goldin,,,,10 years ago,https://www.youtube.com/watch?v=kec8L642Y0I
Time-lapse proof of extreme ice loss - James Balog,,,,10 years ago,https://www.youtube.com/watch?v=yTDdY1UG7ug
"Symmetry, reality's riddle - Marcus du Sautoy",,,,10 years ago,https://www.youtube.com/watch?v=1xlAaBrIxMs
On being a woman and a diplomat - Madeleine Albright,,,,10 years ago,https://www.youtube.com/watch?v=7wzceILi774
A short intro to the Studio School - Geoff Mulgan,,,,10 years ago,https://www.youtube.com/watch?v=xl30RwACSq8
A doctor's touch - Abraham Verghese,,,,10 years ago,https://www.youtube.com/watch?v=uoWp52mfUjg
Fighting a contagious cancer - Elizabeth Murchison,,,,10 years ago,https://www.youtube.com/watch?v=uWWFXpldgMQ
Hire the hackers! - Misha Glenny,,,,10 years ago,https://www.youtube.com/watch?v=hecdjLbm5_g
Our failing schools. Enough is enough! - Geoffrey Canada,,,,10 years ago,https://www.youtube.com/watch?v=mABIBvhsgQ4
Teachers need real feedback - Bill Gates,,,,10 years ago,https://www.youtube.com/watch?v=dCMbGlqzHE0
Cloudy with a chance of joy - Gavin Pretor-Pinney,,,,10 years ago,https://www.youtube.com/watch?v=xcxGNyex3aE
The voice of the natural world - Bernie Krause,,,,10 years ago,https://www.youtube.com/watch?v=G0My5NfboxM
Michael Green: Why we should build wooden skyscrapers,,,,10 years ago,https://www.youtube.com/watch?v=K5cvHHUnpKo
Sex needs a new metaphor. Here's one ... - Al Vernacchio,,,,10 years ago,https://www.youtube.com/watch?v=FeqPCWrw-t4
What's wrong with our food system - Birke Baehr,,,,10 years ago,https://www.youtube.com/watch?v=TUmdC3C2B4w
Protecting the brain against concussion - Kim Gorgens,,,,10 years ago,https://www.youtube.com/watch?v=1Wmjeu0YqPk
The science of macaroni salad: What's in a molecule? - Josh Kurz,,,,10 years ago,https://www.youtube.com/watch?v=4WR0_gEEZ9I
Why you will fail to have a great career - Larry Smith,,,,10 years ago,https://www.youtube.com/watch?v=gDkJ-ry6aSk
My immigration story - Tan Le,,,,10 years ago,https://www.youtube.com/watch?v=ILZir52FssA
An unexpected place of healing - Ramona Pierson,,,,10 years ago,https://www.youtube.com/watch?v=hueCKLP-hOg
My friend Richard Feynman - Leonard Susskind,,,,10 years ago,https://www.youtube.com/watch?v=5t7DnKa1KVU
Using nature to grow batteries - Angela Belcher,,,,10 years ago,https://www.youtube.com/watch?v=VdkV8nyqpNs
A radical experiment in empathy - Sam Richards,,,,10 years ago,https://www.youtube.com/watch?v=ysqFHuICt0w
A whistleblower you haven't heard - Geert Chatrou,,,,10 years ago,https://www.youtube.com/watch?v=x4fgPHvsP2I
Gaming to re-engage boys in learning - Ali Carr-Chellman,,,,10 years ago,https://www.youtube.com/watch?v=A3ZC9OyHWO4
What nonprofits can learn from Coca-Cola - Melinda French Gates,,,,10 years ago,https://www.youtube.com/watch?v=Xv4I-Amo5Bw
My seven species of robot - Dennis Hong,,,,10 years ago,https://www.youtube.com/watch?v=VyMaqh2ELR0
The economic case for preschool - Timothy Bartik,,,,10 years ago,https://www.youtube.com/watch?v=P1pD6zi-lbU
Crowdsource your health - Lucien Engelen,,,,10 years ago,https://www.youtube.com/watch?v=Y8I7YiZ68jE
What you don't know about marriage - Jenna McCarthy,,,,10 years ago,https://www.youtube.com/watch?v=gN-U_hHtPL4
Everyday leadership - Drew Dudley,,,,10 years ago,https://www.youtube.com/watch?v=uAy6EawKKME
Shape-shifting dinosaurs - Jack Horner,,,,10 years ago,https://www.youtube.com/watch?v=WqkFIIoa_V8
"Women entrepreneurs, example not exception - Gayle Tzemach Lemmon",,,,10 years ago,https://www.youtube.com/watch?v=rTBfuoysQYQ
"1000 TEDTalks, 6 words - Sebastian Wernicke",,,,10 years ago,https://www.youtube.com/watch?v=e5pklFtGthY
Life's third act - Jane Fonda,,,,10 years ago,https://www.youtube.com/watch?v=E7yePfnLKCU
There are no scraps of men - Alberto Cairo,,,,10 years ago,https://www.youtube.com/watch?v=kwgjaW3Bx18
How to topple a dictator - Srdja Popovic,,,,10 years ago,https://www.youtube.com/watch?v=5uj_mzEqFRk
It's time to question bio-engineering - Paul Root Wolpe,,,,10 years ago,https://www.youtube.com/watch?v=k2NQ2SFuSN4
Should you trust your first impression? - Peter Mende-Siedlecki,,,,10 years ago,https://www.youtube.com/watch?v=eK0NzsGRceg
Who won the space race?  - Jeff Steers,,,,10 years ago,https://www.youtube.com/watch?v=FxpC-8f--xo
A brief history of video games (Part I) - Safwat Saleem,,,,10 years ago,https://www.youtube.com/watch?v=x24KoVNliMk
"RNAi: Slicing, dicing and serving your cells - Alex Dainis",,,,10 years ago,https://www.youtube.com/watch?v=tzlGU5EI9rU
The good news of the decade? - Hans Rosling,,,,10 years ago,https://www.youtube.com/watch?v=xVBNT7phYsg
Taking imagination seriously - Janet Echelman,,,,10 years ago,https://www.youtube.com/watch?v=10dkp-N0iwU
Inside an Antarctic time machine - Lee Hotz,,,,10 years ago,https://www.youtube.com/watch?v=miY2D_g3aZk
A warm embrace that saves lives - Jane Chen,,,,10 years ago,https://www.youtube.com/watch?v=lL3qzjKkirs
String theory - Brian Greene,,,,10 years ago,https://www.youtube.com/watch?v=kF4ju6j6aLE
The science behind a climate headline - Rachel Pike,,,,10 years ago,https://www.youtube.com/watch?v=jtRv4qouBEo
What we learn before we're born - Annie Murphy Paul,,,,10 years ago,https://www.youtube.com/watch?v=N-E1msIJ9Hw
How to stop torture - Karen Tse,,,,10 years ago,https://www.youtube.com/watch?v=5NWKsEbc3XU
Experiments that hint of longer lives - Cynthia Kenyon,,,,10 years ago,https://www.youtube.com/watch?v=rdrY3Z7c-Ps
A map of the brain - Allan Jones,,,,10 years ago,https://www.youtube.com/watch?v=69K5rjy_euo
Ancient wonders captured in 3D - Ben Kacyra,,,,10 years ago,https://www.youtube.com/watch?v=TFe6Vsrh1QE
The real reason for brains - Daniel Wolpert,,,,10 years ago,https://www.youtube.com/watch?v=_DdU4ehCzUM
A plane you can drive - Anna Mracek Dietrich,,,,10 years ago,https://www.youtube.com/watch?v=JAeIeYLlvTU
"Trust, morality -- and oxytocin? - Paul Zak",,,,10 years ago,https://www.youtube.com/watch?v=UdkueC7KzkM
How economic inequality harms societies - Richard Wilkinson,,,,10 years ago,https://www.youtube.com/watch?v=Ndh58GGCTQo
"A prosthetic arm that ""feels"" - Todd Kuiken",,,,10 years ago,https://www.youtube.com/watch?v=FVmPPVNlvxE
Freeing energy from the grid - Justin Hall-Tipping,,,,10 years ago,https://www.youtube.com/watch?v=6IxcsokEGx0
Learning from a barefoot movement - Bunker Roy,,,,10 years ago,https://www.youtube.com/watch?v=irY8WHObovM
How to spot a liar - Pamela Meyer,,,,10 years ago,https://www.youtube.com/watch?v=eZ4zlkhdcCw
The day I turned down Tim Berners-Lee - Ian Ritchie,,,,10 years ago,https://www.youtube.com/watch?v=EnMQQH1-itg
What do babies think? - Alison Gopnik,,,,10 years ago,https://www.youtube.com/watch?v=B6n_xSP1fxA
Trusting the ensemble - Charles Hazlewood,,,,10 years ago,https://www.youtube.com/watch?v=jeGjmVX0d50
We can recycle plastic - Mike Biddle,,,,10 years ago,https://www.youtube.com/watch?v=DbnaWoEHiMM
The generation that's remaking China - Yang Lan,,,,10 years ago,https://www.youtube.com/watch?v=WJoSHQvniDY
Battling bad science - Ben Goldacre,,,,10 years ago,https://www.youtube.com/watch?v=ch9dLgYxD_0
Filming democracy in Ghana - Jarreth Merz,,,,10 years ago,https://www.youtube.com/watch?v=yKVlFTewDE4
Mysteries of vernacular: Keister - Jessica Oreck and Rachael Teel,,,,10 years ago,https://www.youtube.com/watch?v=FBOD4QTYa0k
Massive-scale online collaboration - Luis von Ahn,,,,10 years ago,https://www.youtube.com/watch?v=p5v7h4wQDPg
How to defend Earth from asteroids - Phil Plait,,,,10 years ago,https://www.youtube.com/watch?v=GpI3_Y9My4w
The shared experience of absurdity - Charlie Todd,,,,10 years ago,https://www.youtube.com/watch?v=ewWIDwRMVJw
How cyberattacks threaten real-world peace - Guy-Philippe Goldstein,,,,10 years ago,https://www.youtube.com/watch?v=_ParhjlvHbg
Finding life we can't imagine - Christoph Adami,,,,10 years ago,https://www.youtube.com/watch?v=p89ZirjNPMQ
A civil response to violence - Emiliano Salinas,,,,10 years ago,https://www.youtube.com/watch?v=kktr4ssaC_Y
"We need a ""moral operating system"" - Damon Horowitz",,,,10 years ago,https://www.youtube.com/watch?v=1aVGf4G72IA
Faith versus tradition in Islam - Mustafa Akyol,,,,10 years ago,https://www.youtube.com/watch?v=3L31XDIbIFI
Distant time and the hint of a multiverse - Sean Carroll,,,,10 years ago,https://www.youtube.com/watch?v=E3FTvL6A1gQ
A lab the size of a postage stamp - George Whitesides,,,,10 years ago,https://www.youtube.com/watch?v=g6GaWlQGbfQ
How to make work-life balance work - Nigel Marsh,,,,10 years ago,https://www.youtube.com/watch?v=_GgrKjsLrZg
Are we born to run? - Christopher McDougall,,,,10 years ago,https://www.youtube.com/watch?v=jB7xaaV8Rus
The economic injustice of plastic - Van Jones,,,,10 years ago,https://www.youtube.com/watch?v=W1UGzaG1Uos
Why do we have to wear sunscreen? - Kevin P. Boyd,,,,10 years ago,https://www.youtube.com/watch?v=ZSJITdsTze0
Mysteries of vernacular: X-ray - Jessica Oreck and Rachael Teel,,,,10 years ago,https://www.youtube.com/watch?v=liMQHQxkSYA
The hidden meanings of yin and yang - John Bellaimey,,,,10 years ago,https://www.youtube.com/watch?v=ezmR9Attpyc
Obesity + Hunger = 1 global food issue - Ellen Gustafson,,,,10 years ago,https://www.youtube.com/watch?v=SXwYyb0AzmA
Let's raise kids to be entrepreneurs - Cameron Herold,,,,10 years ago,https://www.youtube.com/watch?v=s9e6b-csA1Y
Re-examining the remix - Lawrence Lessig,,,,10 years ago,https://www.youtube.com/watch?v=X8ULxxgjBuI
Lessons from fashion's free culture - Johanna Blakley,,,,10 years ago,https://www.youtube.com/watch?v=gLUzgWAEGjY
Math class needs a makeover -  Dan Meyer,,,,10 years ago,https://www.youtube.com/watch?v=qocAoN4jNwc
Why we need to go back to Mars - Joel Levine,,,,10 years ago,https://www.youtube.com/watch?v=7a8Y605PEc8
How I taught rats to sniff out land mines - Bart Weetjens,,,,10 years ago,https://www.youtube.com/watch?v=nEm5zR1IND0
Mysteries of vernacular: Zero - Jessica Oreck and Rachael Teel,,,,10 years ago,https://www.youtube.com/watch?v=rkZrzmVZnCA
The science of macaroni salad: What's in a mixture? - Josh Kurz,,,,10 years ago,https://www.youtube.com/watch?v=Vt7lN4QPU0k
What's the definition of comedy? Banana. - Addison Anderson,,,,10 years ago,https://www.youtube.com/watch?v=s7ilIYMqjJA
How to take a great picture - Carolina Molinari,,,,10 years ago,https://www.youtube.com/watch?v=-6Doq-mdx6w
The shape-shifting future of the mobile phone - Fabian Hemmert,,,,10 years ago,https://www.youtube.com/watch?v=zJQsXxbZEiI
Greening the ghetto - Majora Carter,,,,10 years ago,https://www.youtube.com/watch?v=q2TewSL_Egk
Atheism 2.0 - Alain de Botton,,,,10 years ago,https://www.youtube.com/watch?v=RBFHVOLhxOk
Meet the Water Canary - Sonaar Luthra,,,,10 years ago,https://www.youtube.com/watch?v=c3KEiiDys_8
How healthy living nearly killed me - A.J. Jacobs,,,,10 years ago,https://www.youtube.com/watch?v=I4Ou5otqjqE
A prosthetic eye to treat blindness - Sheila Nirenberg,,,,10 years ago,https://www.youtube.com/watch?v=RR08NcoBlms
Put a value on nature! - Pavan Sukhdev,,,,10 years ago,https://www.youtube.com/watch?v=gMem9QalY-o
Praising slowness - Carl Honore,,,,10 years ago,https://www.youtube.com/watch?v=npRXazR1LtU
How I discovered DNA - James Watson,,,,10 years ago,https://www.youtube.com/watch?v=RvdxGDJogtA
Mysteries of vernacular: Sarcophagus - Jessica Oreck and Rachael Teel,,,,10 years ago,https://www.youtube.com/watch?v=s0-iSrj6pNU
3 stories of local eco-entrepreneurship - Majora Carter,,,,10 years ago,https://www.youtube.com/watch?v=z4SWD5NHO18
How to expose the corrupt - Peter Eigen,,,,10 years ago,https://www.youtube.com/watch?v=aRRE5TEnfsA
Technology's epic story - Kevin Kelly,,,,10 years ago,https://www.youtube.com/watch?v=y97hd9voaJE
Inside the Egyptian revolution - Wael Ghonim,,,,10 years ago,https://www.youtube.com/watch?v=C352T7xttbM
Don't insist on English! - Patricia Ryan,,,,10 years ago,https://www.youtube.com/watch?v=sCTI5tcnEok
The terrors of sleep paralysis - Ami Angelowicz,,,,10 years ago,https://www.youtube.com/watch?v=Ub8Wj_tJhdQ
What's below the tip of the iceberg? - Camille Seaman,,,,10 years ago,https://www.youtube.com/watch?v=-PPGe7MU6ME
What is chemical equilibrium? - George Zaidan and Charles Morton,,,,10 years ago,https://www.youtube.com/watch?v=dUMmoPdwBy4
What creates a total solar eclipse? - Andy Cohen,,,,10 years ago,https://www.youtube.com/watch?v=Qog18tiNnqg
A brief history of plural word...s - John McWhorter,,,,10 years ago,https://www.youtube.com/watch?v=_gwJHuEa9Jc
Making a TED-Ed Lesson: Two ways to animate slam poetry,,,,10 years ago,https://www.youtube.com/watch?v=onZEkLpQ0FA
Ultrasound surgery -- healing without cuts - Yoav Medan,,,,10 years ago,https://www.youtube.com/watch?v=9-M6lv57394
A census of the ocean - Paul Snelgrove,,,,10 years ago,https://www.youtube.com/watch?v=pmPw_6fAFQM
Listening to shame - Brené Brown,,,,10 years ago,https://www.youtube.com/watch?v=7jtZdSRst94
Let's transform energy -- with natural gas - T. Boone Pickens,,,,10 years ago,https://www.youtube.com/watch?v=4NxN6PmxlBM
"Yup, I built a nuclear fusion reactor - Taylor Wilson",,,,10 years ago,https://www.youtube.com/watch?v=lV28dOGC_ps
Mysteries of vernacular: Fizzle - Jessica Oreck and Rachael Teel,,,,10 years ago,https://www.youtube.com/watch?v=4TGixIAP92c
How to read music - Tim Hansen,,,,10 years ago,https://www.youtube.com/watch?v=ZN41d7Txcq0
Tribal leadership - David Logan,,,,11 years ago,https://www.youtube.com/watch?v=ATbyOuk0bvE
Animating a photo-real digital face - Paul Debevec,,,,11 years ago,https://www.youtube.com/watch?v=r25lOeggxIw
Building a theater that remakes itself - Joshua Prince-Ramus,,,,11 years ago,https://www.youtube.com/watch?v=o78pDcZAxF8
Creative houses from reclaimed stuff - Dan Phillips,,,,11 years ago,https://www.youtube.com/watch?v=owbfNJMumEs
The case for collaborative consumption - Rachel Botsman,,,,11 years ago,https://www.youtube.com/watch?v=X6FOp65MvxE
Exploring other dimensions - Alex Rosenthal and George Zaidan,,,,11 years ago,https://www.youtube.com/watch?v=C6kn6nXMWF0
"Got seeds? Just add bleach, acid and sandpaper - Mary Koga",,,,11 years ago,https://www.youtube.com/watch?v=9zmB3Gx3e_s
What is dyslexia? - Kelli Sandman-Hurley,,,,11 years ago,https://www.youtube.com/watch?v=zafiGBrFkRM
The moral dangers of non-lethal weapons - Stephen Coleman,,,,11 years ago,https://www.youtube.com/watch?v=GCA93_exJDw
What we learned from 5 million books - Erez Lieberman Aiden and Jean-Baptiste Michel,,,,11 years ago,https://www.youtube.com/watch?v=50MpgVJ8xAE
Making a TED-Ed Lesson: Animating zombies,,,,11 years ago,https://www.youtube.com/watch?v=INFKdqxLgPs
Animation basics: The optical illusion of motion - TED-Ed,,,,11 years ago,https://www.youtube.com/watch?v=V8A4qudmsX0
The best stats you've ever seen - Hans Rosling,,,,11 years ago,https://www.youtube.com/watch?v=usdJgEwMinM
The surprising science of happiness - Nancy Etcoff,,,,11 years ago,https://www.youtube.com/watch?v=uaalzEf5kPA
How to look inside the brain - Carl Schoonover,,,,11 years ago,https://www.youtube.com/watch?v=sYhMAjfdxD8
Texting that saves lives - Nancy Lublin,,,,11 years ago,https://www.youtube.com/watch?v=SItBgBy_oZk
The 4 commandments of cities - Eduardo Paes,,,,11 years ago,https://www.youtube.com/watch?v=C_QRAHTw4M8
Tracking ancient diseases using ... plaque - Christina Warinner,,,,11 years ago,https://www.youtube.com/watch?v=U8c1H4k21SU
"Unlock the intelligence, passion, greatness of girls - Leymah Gbowee",,,,11 years ago,https://www.youtube.com/watch?v=0aANTxQLeAo
Mysteries of vernacular: Jade - Jessica Oreck and Rachael Teel,,,,11 years ago,https://www.youtube.com/watch?v=wLmi3CYGjX4
Da Vinci's Vitruvian Man of math - James Earle,,,,11 years ago,https://www.youtube.com/watch?v=aMsaFP3kgqQ
Visualizing the medical data explosion - Anders Ynnerman,,,,11 years ago,https://www.youtube.com/watch?v=4SZ_5fGEdpk
The linguistic genius of babies - Patricia Kuhl,,,,11 years ago,https://www.youtube.com/watch?v=M-ymanHajN8
Why work doesn't happen at work - Jason Fried,,,,11 years ago,https://www.youtube.com/watch?v=fXdsmvaXx78
How Mr. Condom made Thailand a better place - Mechai Viravaidya,,,,11 years ago,https://www.youtube.com/watch?v=fSznVBd37Uo
The power of vulnerability - Brené Brown,,,,11 years ago,https://www.youtube.com/watch?v=JjNtWRBdXws
The infinite life of pi - Reynaldo Lopes,,,,11 years ago,https://www.youtube.com/watch?v=9a5vHXsUvUw
Comma story - Terisa Folaron,,,,11 years ago,https://www.youtube.com/watch?v=GHnl1O3NGJk
Myths and misconceptions about evolution - Alex Gendler,,,,11 years ago,https://www.youtube.com/watch?v=mZt1Gn0R22Q
Making a TED-Ed Lesson: Synesthesia and playing cards,,,,11 years ago,https://www.youtube.com/watch?v=HMpi8Zf6FFc
4 lessons from robots about being human - Ken Goldberg,,,,11 years ago,https://www.youtube.com/watch?v=HiKM-Mc3DHg
Toward a new understanding of mental illness - Thomas Insel,,,,11 years ago,https://www.youtube.com/watch?v=CUuyzoTI948
Free falling in outer space - Matt J. Carlson,,,,11 years ago,https://www.youtube.com/watch?v=tAUXIEr-VzM
On spaghetti sauce - Malcolm Gladwell,,,,11 years ago,https://www.youtube.com/watch?v=VkhFh5Ms1vc
On positive psychology - Martin Seligman,,,,11 years ago,https://www.youtube.com/watch?v=5CpLEOO5oyo
Mining minerals from seawater - Damian Palin,,,,11 years ago,https://www.youtube.com/watch?v=nZk_BQm_vZU
What if our healthcare system kept us healthy? - Rebecca Onie,,,,11 years ago,https://www.youtube.com/watch?v=3NjEV064AQ4
"The 100,000-student classroom - Peter Norvig",,,,11 years ago,https://www.youtube.com/watch?v=Olni0KKdZqc
Advice to young scientists - E.O. Wilson,,,,11 years ago,https://www.youtube.com/watch?v=ptJg2GScPEQ
How Arduino is open-sourcing imagination - Massimo Banzi,,,,11 years ago,https://www.youtube.com/watch?v=eFCk3qWmCoo
Mysteries of vernacular: Quarantine - Jessica Oreck and Rachael Teel,,,,11 years ago,https://www.youtube.com/watch?v=MBZBqNrsAPM
Why eyewitnesses get it wrong - Scott Fraser,,,,11 years ago,https://www.youtube.com/watch?v=4TQETLZZmcM
Welcome to the genomic revolution - Richard Resnick,,,,11 years ago,https://www.youtube.com/watch?v=nAljnpoKVLw
Your brain on improv - Charles Limb,,,,11 years ago,https://www.youtube.com/watch?v=U4k5JFmahVY
Moral behavior in animals - Frans de Waal,,,,11 years ago,https://www.youtube.com/watch?v=PnnSjdpoBVw
Distant time and the hint of a multiverse - Sean Carroll,,,,11 years ago,https://www.youtube.com/watch?v=5vUWmID5as8
What is an aurora? - Michael Molina,,,,11 years ago,https://www.youtube.com/watch?v=czMh3BnHFHQ
Beatboxing 101 - BEAT NYC,,,,11 years ago,https://www.youtube.com/watch?v=U0MCXDy0J0g
Inside your computer - Bettina Bair,,,,11 years ago,https://www.youtube.com/watch?v=AkFi90lZmXA
Image recognition that triggers augmented reality - Matt Mills,,,,11 years ago,https://www.youtube.com/watch?v=_pnUsvZzs5g
The human and the honeybee - Dino Martins,,,,11 years ago,https://www.youtube.com/watch?v=ZJZsM4flpN4
A tale of mental illness -- from the inside - Elyn Saks,,,,11 years ago,https://www.youtube.com/watch?v=tuv3R5uYm8s
